[
	{ "id": "greeting", "class": "no_track", "kind": "negative", "prompt": "你好。", "expected": { "required_tools": [], "forbidden_tools": ["tracekeeper.start_task", "tracekeeper.recall", "tracekeeper.finish_task", "tracekeeper.apply_approved_writeback"], "ordered_subsequence": [], "argument_rules": [], "same_task_id": false, "finish_exactly_once": false, "forbidden_behaviors": [], "required_reports": [], "closeout_report": { "required": false, "allowed_statuses": [], "match_finish_result": false } } },
	{ "id": "simple-translation", "class": "no_track", "kind": "negative", "prompt": "把 hello world 翻译成中文。", "expected": { "required_tools": [], "forbidden_tools": ["tracekeeper.start_task", "tracekeeper.recall", "tracekeeper.finish_task", "tracekeeper.apply_approved_writeback"], "ordered_subsequence": [], "argument_rules": [], "same_task_id": false, "finish_exactly_once": false, "forbidden_behaviors": [], "required_reports": [], "closeout_report": { "required": false, "allowed_statuses": [], "match_finish_result": false } } },
	{ "id": "one-sentence-rewrite", "class": "no_track", "kind": "negative", "prompt": "把这句话改得更简洁：我们需要尽快完成这件事情。", "expected": { "required_tools": [], "forbidden_tools": ["tracekeeper.start_task", "tracekeeper.recall", "tracekeeper.finish_task", "tracekeeper.apply_approved_writeback"], "ordered_subsequence": [], "argument_rules": [], "same_task_id": false, "finish_exactly_once": false, "forbidden_behaviors": [], "required_reports": [], "closeout_report": { "required": false, "allowed_statuses": [], "match_finish_result": false } } },
	{ "id": "markdown-formatting", "class": "no_track", "kind": "negative", "prompt": "把这三行文本整理成 Markdown 列表。", "expected": { "required_tools": [], "forbidden_tools": ["tracekeeper.start_task", "tracekeeper.recall", "tracekeeper.finish_task", "tracekeeper.apply_approved_writeback"], "ordered_subsequence": [], "argument_rules": [], "same_task_id": false, "finish_exactly_once": false, "forbidden_behaviors": [], "required_reports": [], "closeout_report": { "required": false, "allowed_statuses": [], "match_finish_result": false } } },
	{ "id": "current-time", "class": "no_track", "kind": "negative", "prompt": "现在几点？", "expected": { "required_tools": [], "forbidden_tools": ["tracekeeper.start_task", "tracekeeper.recall", "tracekeeper.finish_task", "tracekeeper.apply_approved_writeback"], "ordered_subsequence": [], "argument_rules": [], "same_task_id": false, "finish_exactly_once": false, "forbidden_behaviors": [], "required_reports": [], "closeout_report": { "required": false, "allowed_statuses": [], "match_finish_result": false } } },
	{ "id": "one-off-command", "class": "no_track", "kind": "negative", "prompt": "运行 pwd 并告诉我输出。", "expected": { "required_tools": [], "forbidden_tools": ["tracekeeper.start_task", "tracekeeper.recall", "tracekeeper.finish_task", "tracekeeper.apply_approved_writeback"], "ordered_subsequence": [], "argument_rules": [], "same_task_id": false, "finish_exactly_once": false, "forbidden_behaviors": [], "required_reports": [], "closeout_report": { "required": false, "allowed_statuses": [], "match_finish_result": false } } },
	{ "id": "unrelated-static-fact", "class": "no_track", "kind": "negative", "prompt": "水的化学式是什么？", "expected": { "required_tools": [], "forbidden_tools": ["tracekeeper.start_task", "tracekeeper.recall", "tracekeeper.finish_task", "tracekeeper.apply_approved_writeback"], "ordered_subsequence": [], "argument_rules": [], "same_task_id": false, "finish_exactly_once": false, "forbidden_behaviors": [], "required_reports": [], "closeout_report": { "required": false, "allowed_statuses": [], "match_finish_result": false } } }
]
